"title","obis","records","totalrecords","taxa","org_country"
"EOD - eBird Observation Dataset",,23369565,151089538,527,"US"
"Artdata",,8592103,39494133,2435,"SE"
"Norwegian Species Observation Service",,3737077,12253548,917,"NO"
"Tiira information service",,3310762,12286529,166,"FI"
"NMNH occurrence DwC-A",,1252194,4360072,88936,"US"
"Bird tracking - GPS tracking of Lesser Black-backed Gulls and Herring Gulls breeding at the southern North Sea coast",,1181274,1181274,2,"BE"
"DOF",,1093044,2975350,172,"DK"
"Fishbase",,878897,1211853,16297,"SE"
"Continuous Plankton Recorder Dataset (SAHFOS)",,867233,911800,315,"GB"
"Australian Museum provider for OZCAM",,847925,1813049,31993,"AU"
"OEH Atlas of NSW Wildlife",,841791,7696309,247,"AU"
"SEAMAP - marine mammals, birds and turtles",t,706949,743626,343,""
"Dutch Foundation for Applied Water Research (STOWA) - Limnodata Neerlandica",,645653,2558688,1241,"NL"
"NODC WOD01 Plankton Database",t,625630,646428,2138,""
"Geographically tagged INSDC sequences",,538878,4479782,9399,"GB"
"Southern African Bird Atlas Project",,532010,5016748,137,"ZA"
"naturgucker",,528582,4246432,1738,"DE"
"Joint Nature Conservation Committee - Marine Nature Conservation Review (MNCR) and associated benthic marine data held and managed by JNCC",,485858,486795,2944,"GB"
"KTP Ring Data",,480819,480819,13,"DK"
"BirdLife Australia, Birdata",,478256,7273616,174,"AU"
"Museum of Comparative Zoology, Harvard University",,462431,1495474,36501,"US"
"ECNASAP - East Coast North America Strategic Assessment (OBIS Canada)",t,440070,440070,270,""
"Royal Dutch Angling Association (SVN) - Piscaria",,429934,466943,64,"NL"
"Natural History Museum (London) Collection Specimens",,405056,1524452,73969,"GB"
"invertebratezoology",,404027,604568,18741,"US"
"DOF 2001-2006",,370128,1096267,129,"DK"
"Bird Ringing Centre in Sweden (NRM)",,369831,4852502,92,"SE"
"Continuous Plankton Recorder database",t,368095,430555,126,""
"``South Western Pacific Regional OBIS Data provider for the NIWA Marine Biodata Information System``",t,363065,363193,410,""
"Naturalis Biodiversity Center (NL) - Mollusca",,350125,492426,17047,"NL"
"ARGOS Satellite Tracking of animals",,346511,346511,19,"AU"
"Marine Conservation Society - Seasearch Marine Surveys",,326608,326746,1682,"GB"
"Great Backyard Bird Count",,315764,7073027,167,"US"
"HMAP-History pf Marine Animal Populations (CoML)",t,312340,312340,483,""
"VIS - Fishes in inland waters in Flanders, Belgium",,308805,359262,49,"BE"
"SAFRING: Historical Bird Ringing Records (2005-2009)",,293033,1769995,169,"ZA"
"SEAPOP NINA",,283612,299586,59,"NO"
"Royal Netherlands Institute for Sea Research (NIOZ) - Kom Fyke Mokbaai",,273002,273002,106,"NL"
"Watervogels - Wintering waterbirds in Flanders, Belgium",,271391,601462,101,"BE"
"Eremaea",,256515,2692286,201,"AU"
"Biological Records Centre - Database for the Atlas of Freshwater Fishes",,254349,271263,50,"GB"
"European Seabirds at Sea (ESAS) bird sightings from 1980 to 2003.",,253471,253642,75,"IE"
"North Pacific Groundfish Observer (North Pacific Research Board)",t,221352,239767,241,""
"United States Geological Survey Nonindigenous Aquatic Species Database",,198532,253177,282,"US"
"First Bird Atlas",,196068,2637201,162,"AU"
"Queensland Museum provider for OZCAM",,191071,519955,18365,"AU"
"Cryptogamy collection (PC) of the Muséum national d'Histoire Naturelle (MNHN - Paris)",,176265,326452,8039,"FR"
"Norwegian Biodiversity Information Centre - Other datasets",,165487,593371,1078,"NO"
"Bernice P. Bishop Museum",,158484,606077,18805,"US"
"Joint Nature Conservation Committee - Marine benthic dataset (version 1) commissioned by UKOOA",,157902,157904,1318,"GB"
"Australia's Virtual Herbarium",,146656,4603527,4420,"AU"
"SLU Aqua Institute of Coastal Research Database for Coastal Fish - KUL",,146382,146382,91,"SE"
"DFO Maritimes Research Vessel Trawl Surveys Fish Observations (OBIS Canada)",t,137298,137298,201,""
"LACM Vertebrate Collection",,137134,512814,6077,"US"
"Naturalis Biodiversity Center (NL) - Botany Leiden",,137134,2689577,6602,"NL"
"CAS Ichthyology (ICH)",,136062,167913,12645,"US"
"Inventaire National du Patrimoine Naturel : Données ONEMA sur les poissons et écrevisses d'eau douce.",,135765,177239,49,"FR"
"UF FLMNH Ichthyology",,134398,208916,4941,"US"
"Neptune Deep-Sea Microfossil Occurrence Database",,131691,324473,684,"DE"
"Museum Victoria provider for OZCAM",,130105,505423,11796,"AU"
"Seabirds of the Southern and South Indian Ocean",,130105,130615,111,"AU"
"University of British Columbia Herbarium (UBC) - Algae Collection",,129741,133698,3422,"CA"
"Suffolk Biological Records Centre - Suffolk Biological Records Centre (SBRC) dataset",,123539,2068289,621,"GB"
"Elephant Seal Sightings, Macquarie Island",,120000,120000,1,"AU"
"Dutch Vegetation Database (LVD)",,119822,9388686,46,"NL"
"Rotherham Biological Records Centre - Rotherham Biological Records Centre - Non-sensitive Records from all taxonomic groups",,119678,1406810,398,"GB"
"UWFC Ichthyology Collection",t,119541,129324,3001,"US"
"Arctic Ocean Diversity",,118126,120626,1437,""
"Pacific Ocean Shelf Tracking (OBIS Canada)",t,113941,113941,13,""
"SA Fauna (BDBSA)",,113228,845394,173,"AU"
"Biologiezentrum Linz",,112023,1971075,2323,"AT"
"EPA'S EMAP Database",t,111597,113601,3239,""
"Centre for Environmental Data and Recording - Marine Data from Northern Ireland",,110697,110786,1578,"GB"
"British Phycological Society - Seaweed data for Great Britain and Ireland",,110480,110483,603,"GB"
"Quadrige",,109775,110002,155,"FR"
"Invertebrates Collection of the Swedish Museum of Natural History",,107728,118492,7960,"SE"
"ANTAVIA-TrackingKing",,103455,103455,1,""
"Southern Ocean Continuous Zooplankton Recorder (SO-CPR) Survey",,103277,103277,84,"AU"
"CSIRO Marine Data Warehouse (OBIS Australia)",t,103135,103140,1237,""
"Botanical Museum, Copenhagen, the Phycology Herbarium",,102811,104133,781,"DK"
"MAL",,101588,171413,16109,"US"
"Countryside Council for Wales - Marine data from Countryside Council for Wales (CCW) Technical Support (Research & Monitoring) Contracts, Wales",,101583,101621,1883,"GB"
"Northern Territory Museum and Art Gallery provider for OZCAM",,100722,159804,12339,"AU"
"Marine Biological Association - Marine survey data (Professional) held by <i>MarLIN</i>.",,96437,96440,1530,"GB"
"South African Institute for Aquatic Biodiversity - Fish Collection (AfrOBIS)",t,95066,95439,4211,""
"Inventaire National du Patrimoine Naturel : Poissons d'eau douce de France",,94819,120208,73,"FR"
"CAS Invertebrate Zoology (IZ)",,91995,97624,11062,"US"
"NBI",t,89466,90052,2260,""
"Marine and Coastal Management - Linefish Dataset (First Semester of 1989) (AfrOBIS)",t,84940,85112,90,""
"NINA Vanndata fisk",,84939,84986,39,"NO"
"Banco de Datos de la Biodiversidad de la Comunitat Valenciana",,83338,1310643,1969,"ES"
"Marine and Coastal Management - Linefish Dataset (First Semester of 1990) (AfrOBIS)",t,82464,82568,94,""
"Atlantic Reference Centre (OBIS Canada)",t,82379,82746,2036,""
"Image Database of Fishes in the Kanagawa Prefectural Museum of Natural History",,82005,85383,3483,"JP"
"RBINS collections",,81957,333463,11148,"BE"
"Fishes collection (IC) of the Muséum national d'Histoire naturelle (MNHN - Paris)",,81717,114016,7987,"FR"
"Hawk Migration Association of North America - HawkCount",,80569,634258,3,"US"
"ecoscope_observation_database",,79467,79467,204,"FR"
"Southampton Oceanography Center Discovery Collections Midwater Database",t,79199,80095,1530,""
"Marine and Coastal Management - Linefish Dataset (First Semester of 1993) (AfrOBIS)",t,78906,79129,98,""
"Inventaire National du Patrimoine Naturel : Oiseaux hivernants de France",,78700,755318,96,"FR"
"Naturalis Biodiversity Center (NL) - Crustacea",,78436,90971,8053,"NL"
"Conchological Society of Great Britain &amp; Ireland - Mollusc (marine) data for Great Britain and Ireland",,76713,76750,538,"GB"
"Marine and Coastal Management - Linefish Dataset (First Semester of 1988) (AfrOBIS)",t,76311,76497,97,""
"Molluscs collection (IM) of the Muséum national d'Histoire naturelle (MNHN - Paris)",,75649,81385,8364,"FR"
"iNaturalist research-grade observations",,75546,588735,4416,"US"
"Marine and Coastal Management - Linefish Dataset (First Semester of 1987) (AfrOBIS)",t,75411,75553,87,""
"Point Reyes Bird Observatory - Point Counts",,74517,900613,60,"US"
"Museo Nacional de Ciencias Naturales, Madrid: MNCN_ICTIO",,73098,192785,1090,"ES"
"Historical Bird Atlas",,73061,730794,162,"AU"
"Marine and Coastal Management - Linefish Dataset (First Semester of 1991) (AfrOBIS)",t,72950,73067,99,""
"Scottish Natural Heritage - Marine Nature Conservation Review (MNCR) and associated benthic marine data held and managed by Scottish Natural Heritage",,71510,71608,1741,"GB"
"Marine and Coastal Management - Linefish Dataset (Second Semester of 1992) (AfrOBIS)",t,71329,71616,98,""
"Marine and Coastal Management - Linefish Dataset (First Semester of 1995) (AfrOBIS)",t,70467,70610,87,""
"Marine and Coastal Management - Demersal Surveys (years 1991-1995) (AfrOBIS)",t,70141,70141,392,""
"RSPB - Bird Conservation Targeting Project (BCTP) in the UK, archived data (2001-2008)",,69946,247955,3,"GB"
"Marine and Coastal Management - Linefish Dataset (First Semester of 1992) (AfrOBIS)",t,69197,69383,90,""
"Marine and Coastal Management - Linefish Dataset (First Semester of 1996) (AfrOBIS)",t,67247,67373,96,""
"Invertebrate Zoology Division, Yale Peabody Museum",,66985,69870,11004,"US"
"Marine and Coastal Management - Linefish Dataset (Second Semester of 1991) (AfrOBIS)",t,66461,66565,91,""
"Marine and Coastal Management - Linefish Dataset (First Semester of 1986) (AfrOBIS)",t,65712,65880,84,""
"NatureServe Network Species Occurrence Data",,65559,916796,457,"US"
"SLU Aqua  Institute of Freshwater Research Swedish Electrofishing Registry - SERS",,65223,67371,38,"SE"
"Fauna Atlas N.T.",,65086,809470,139,"AU"
"Marine and Coastal Management - Linefish Dataset (Second Semester of 1987) (AfrOBIS)",t,64710,64886,83,""
"Marine and Coastal Management - Linefish Dataset (Second Semester of 1988) (AfrOBIS)",t,64268,64385,88,""
"Marine and Coastal Management - Linefish Dataset (First Semester of 1998) (AfrOBIS)",t,63776,63826,91,""
"Marine and Coastal Management - Linefish Dataset (Second Semester of 1990) (AfrOBIS)",t,63667,63767,84,""
"Long-term decline in krill stock and increase in salps within the Southern Ocean (SCAR-MarBIN: Antarctic OBIS)",t,63364,63364,1,""
"CCAMLR historic KRILL",,63364,63364,1,""
"Marine and Coastal Management - Linefish Dataset (Second Semester of 1993) (AfrOBIS)",t,63316,63470,89,""
"Natural History Museum Rotterdam (NL) - Mollusca collection",,62960,68636,8924,"NL"
"Lund Museum of Zoology (MZLU)",,62878,145455,3816,"SE"
"Marine and Coastal Management - Linefish Dataset (Second Semester of 1989) (AfrOBIS)",t,61920,62027,83,""
"Atlantic and Gulf Rapid Reef Assessment -Benthic (OBIS Australia)",t,61822,61822,59,""
"Fish specimens",,61290,116643,4962,"CA"
"Marine and Coastal Management - Linefish Dataset (Second Semester of 1986) (AfrOBIS)",t,60901,60967,76,""
"The Fish Collection",,60495,64638,5337,"DK"
"Bureau of Rural Sciences National commercial fisheries half-degree data set 2000-2002 (OBIS Australia)",t,59947,60164,377,""
"Ifremer BIOCEAN database (Deep Sea Benthic Fauna)",t,58834,58928,3582,"FR"
"Marine and Coastal Management - Linefish Dataset (Second Semester of 1995) (AfrOBIS)",t,58579,58684,84,""
"Marine and Coastal Management - Linefish Dataset (First Semester of 1999) (AfrOBIS)",t,58435,58493,82,""
"Marine and Coastal Management - Linefish Dataset (Second Semester of 1994) (AfrOBIS)",t,58370,58518,87,""
"Marine and Coastal Management - Linefish Dataset (First Semester of 1997) (AfrOBIS)",t,58188,58263,92,""
"British Lichen Society - BLS Lichen Database: English churchyards",,57977,394718,57,"GB"
"Marine and Coastal Management - Linefish Dataset (First Semester of 1994) (AfrOBIS)",t,57793,57970,105,""
"Marine and Coastal Management - Linefish Dataset (Second Semester of 1998) (AfrOBIS)",t,55770,55830,84,""
"Marine and Coastal Management - Demersal Surveys (years 1986-1990) (AfrOBIS)",t,55498,55498,301,""
"Marine and Coastal Management - Linefish Dataset (First Semester of 2000) (AfrOBIS)",t,54068,54093,77,""
"Planktic foraminifera counts in surface sediment samples",,53445,54093,30,"DE"
"British Antarctic Survey Argos satellite tracking data",,53062,53062,12,"GB"
"PIROP (Shipboard Surveys)",,52980,53314,122,"CA"
"Marine and Coastal Management - Linefish Dataset (Second Semester of 1996) (AfrOBIS)",t,52586,52627,88,""
"Pelagic Fish Observations 1968-1999",,51282,51283,130,"AU"
"Field Museum of Natural History (Zoology) Fish Collection",,51278,89584,7522,"US"
"Ichthyology Collection - Royal Ontario Museum",,50541,80041,4910,"CA"
"Western Australian Museum provider for OZCAM",,50169,327715,4981,"AU"
"Seaweeds of Ireland",,49724,49724,517,"IE"
"Mollusca specimens of Toyama Science Museum",,49607,65498,2569,"JP"
"Marine and Coastal Management - Linefish Dataset (Second Semester of 1997) (AfrOBIS)",t,49432,49474,88,""
"BioMar - LIFE project",,48888,48983,1146,"IE"
"observe_tuna_bycatch_ecoscope",,48393,48393,67,"FR"
"Fish Collection of Hokkaido University",,48241,56366,2385,"JP"
"Dinoflagelados y Diatomeas del Pacífico tropical mexicano",,47213,50775,971,"MX"
"Marine and Coastal Management - Linefish Dataset (Second Semester of 1999) (AfrOBIS)",t,46923,46980,75,""
"Vascular plants in Denmark recorded under the The Nationwide Monitoring and Assessment Programme for the Aquatic and Terrestrial Environments (NOVANA)",,46876,1720355,26,"DK"
"Occurrence records of southern African aquatic biodiversity",,46300,70871,4568,"ZA"
"CABI Bioscience Fungus Collection",,46026,135762,1775,""
"Finnish Winter Bird Census",,44596,869005,61,"FI"
"Wiltshire and Swindon Biological Records Centre - Wiltshire & Swindon Site-based Survey Records",,44383,480160,223,"GB"
"Marine and Coastal Management - Linefish Dataset (First Semester of 2001) (AfrOBIS)",t,44228,44288,71,""
"Marine and Coastal Management - Linefish Dataset (Second Semester of 1985) (AfrOBIS)",t,43689,43746,79,""
"Atlas of Danish Fishes",,43477,46526,50,"DK"
"VIS - Fishes in estuarine waters in Flanders, Belgium",,42690,45156,73,"BE"
"A Biological Survey of the Waters of Woods Hole and Vacinity",t,42150,42665,1240,""
"Marine and Coastal Management - Linefish Dataset (Second Semester of 2000) (AfrOBIS)",t,42138,42183,73,""
"AMNH Bird Collection",,42031,594878,643,"US"
"Tagged Seal Location Data from SOGLOBEC",,41676,41676,1,""
"Invertebrates of the Gothenburg Natural History Museum (GNM)",,41095,44273,2006,"SE"
"AIMS LTM Fish (OBIS Australia)",t,40981,40981,231,""
"British Lichen Society - BLS Mapping Scheme dataset, 1750-2009",,40925,492233,133,"GB"
"Paleobiology Database",,40771,195382,9339,"US"
"British Bryological Society - Bryophyte data for Great Britain from the British Bryological Society held by BRC",,40124,2289640,5,"GB"
"Composition of planktonic foraminifera species in 1123 surface sediment samples compared with sea surface temperatures from the Levitus Atlas",,40034,41013,22,"DE"
"Marine Biological Association - DASSH Data Archive Centre Academic surveys",,39769,39771,1122,"GB"
"QLD DERM Coastal Bird Atlas (Trial)",,39086,59483,95,"AU"
"Countryside Council for Wales - Pembrokeshire Marine Species Atlas",,38824,38870,2107,"GB"
"Botanical Society of the British Isles - Vascular Plants Database",,38732,8451165,25,"GB"
"Tulane University Museum of Natural History",,38411,198548,1630,"US"
"Marine and Coastal Management - Copepod Surveys (AfrOBIS)",t,37756,37756,4,""
"Inventaire National du Patrimoine Naturel : Atlas des poissons d'eau douce de France métropolitaine (2011)",,37734,54373,55,"FR"
"Marine and Coastal Management - Linefish Dataset (First Semester of 2004) (AfrOBIS)",t,37603,37628,62,""
"Bristol Regional Environmental Records Centre - BRERC October 2009",,37220,1522795,443,"GB"
"Marine and Coastal Management - Linefish Dataset (First Semester of 1985) (AfrOBIS)",t,36621,36685,73,""
"Ichthyology, Kagoshima University Museum",,36162,40279,2234,"JP"
"Fish specimens of Fisheries Research Laboratory Mie University",,35840,39994,2227,"JP"
"Environment Agency - Environment Agency freshwater invertebrate species (single species families)",,35227,64004,2,"GB"
"Marine and Coastal Management - Linefish Dataset (First Semester of 2005) (AfrOBIS)",t,34836,34872,66,""
"AIMS - Baited Remote Underwater Video Station (OBIS Australia)",t,33717,33717,670,""
"Marine species distributions in Irish coastal waters",,33632,33646,737,"IE"
"Marine and Coastal Management - Demersal Surveys (years 2001-2005) (AfrOBIS)",t,33196,33196,326,""
"Marine and Coastal Management - Linefish Dataset (Second Semester of 2004) (AfrOBIS)",t,32895,32928,65,""
"Environment Agency - Environment Agency Rare and Protected Species records v1",,32613,35219,12,"GB"
"Naturalis National Natural History Museum (NL) – Crustacea_Decapoda",,32475,35718,3892,"NL"
"RSPB - Bird Conservation Targeting Project (BCTP) in the UK, 2004-2009",,32351,135656,3,"GB"
"WFVZ Bird Collections",,31289,256602,469,"US"
"CSIRO Ichthyology provider for OZCAM",,31069,31979,3659,"AU"
"Field Museum of Natural History (Zoology) Invertebrate Collection",,30912,138101,4402,"US"
"Naturalis National Natural History Museum (NL) – Invertebrate specimens from marine expeditions",,30476,30855,3692,"NL"
"European Molecular Biology Laboratory Australian Mirror",,29838,32254,467,"AU"
"Marine and Coastal Management - Linefish Dataset (Second Semester of 2001) (AfrOBIS)",t,29567,29600,75,""
"Marine and Coastal Management - Linefish Dataset (Second Semester of 2005) (AfrOBIS)",t,29023,29043,62,""
"Distribution of planktic foraminifera in surface sediments of the Atlantic Ocean (ATL947)",,28862,29945,28,"DE"
"Annelida collection of National Museum of Nature and Science",,28771,29059,832,"JP"
"Biodiversity Research and Teaching Collections - TCWC Vertebrates",,28738,213181,2302,"US"
"Canada Maritimes Regional Cetacean Sightings (OBIS Canada)",t,28572,28572,33,""
"South Western Pacific Regional OBIS Data All Sea Bio Subset (South Western P acific OBIS)",t,28496,30528,2330,""
"Fish specimen database of Osaka Museum of Natural History",,28194,42844,1588,"JP"
"Historical hyperbenthos data (1987-2001) from the North Sea and some adjacent areas (EurOBIS)",t,28048,28048,483,""
"Countryside Council for Wales - 1996 - 2005 CCW Marine Intertidal Phase 1 species dataset",,28012,28154,590,"GB"
"MedOBIS (EurOBIS)",t,27960,27998,2154,""
"Diversidad bentónica del ambiente intermareal e infralitoral somero de Progreso, Yucatán",,27959,29118,224,"MX"
"Fish collection of National Museum of Nature and Science",,27725,32170,4171,"JP"
"SANT-Algae",,27591,28054,779,"ES"
"Crustaceans collection (IU) of the Muséum national d'Histoire naturelle (MNHN - Paris)",,27529,30442,5220,"FR"
"The national database for marine data (MADS)",,27250,28532,235,"DK"
"British Lichen Society - BLS Lichen Database: England",,27059,334013,96,"GB"
"Canadian Museum of Nature Fish Collection",,26964,43273,1390,"CA"
"University of Amsterdam (NL) – Benthos monitoring of the North Sea research database",,26900,26904,373,"NL"
"South Australian Museum Australia provider for OZCAM",,26788,199399,1705,"AU"
"Marine and Coastal Management - Linefish Dataset (Second Semester of 2002) (AfrOBIS)",t,26628,26657,65,""
"Botany (UPS)",,26461,602357,2968,"SE"
"UAM Mammal Collection (Arctos)",,26338,119404,55,"US"
"Marine and Coastal Management - Linefish Dataset (Second Semester of 2003) (AfrOBIS)",t,25887,25917,68,""
"Biological Records Centre - Ladybird Survey of the UK",,25878,123462,1,"GB"
"ARABEL - Arachnologia Belgica",,25704,290040,37,"BE"
"Natural Geography In Shore Areas (NaGISA) Dataset",t,25655,25812,1866,""
"SysTax -  Zoological Collections",,25631,163368,7528,"DE"
"The Brown University Foraminiferal Data Base (BFD)",,25471,25819,30,"DE"
"Tasmanian Museum and Art Gallery provider for OZCAM",,25179,35140,2075,"AU"
"University of California Museum of Paleontology",,25172,95373,8402,"US"
"DATAVES",,25141,413008,95,"CO"
"Fish Collection of Yokosuka City Museum",,25102,31826,1234,"JP"
"Marine and Coastal Management - Linefish Dataset (First Semester of 2003) (AfrOBIS)",t,24943,24983,67,""
"Collection Crustacea SMF",,24941,35625,2993,"DE"
"Marine and Coastal Management - Linefish Dataset (First Semester of 2002) (AfrOBIS)",t,24764,24793,78,""
"Biogeography Scheldt Estuary (EurOBIS)",t,24752,24797,255,""
"Collection Pisces SMF",,24591,33150,4162,"DE"
"Joint Nature Conservation Committee - Seabird 2000",,24190,24193,25,"GB"
"Diveboard - Scuba diving citizen science observations",,24033,24428,3007,"FR"
"Inventario Español de Especies Terrestres (MAGRAMA)",,23830,628115,106,"ES"
"BIOLOGICAL SCIENCES DATA",,23806,23831,465,"GB"
"Colección de Diatomeas del Sur del Golfo de México (ICMyL-DF, UNAM)",,23779,25584,408,"MX"
"SP-Algae - Herbário do Estado ""Maria Eneyda P. Kaufmann Fidalgo - Coleção de Algas",,23520,28664,1387,"BR"
"Pelagic Fish Observations 1968-1999 (Australian Antarctic Data Centre)",t,23165,23166,128,""
"Israel Nature and Parks Authority",,22344,406636,136,"IL"
"North West Territories and Nunavut Bird Checklist, Canada",,21858,48181,90,"CA"
"Mollusk data of Molltax, Norway",,21646,21758,393,"NO"
"Fish Collection of Kanagawa Prefectural Museum of Natural History",,21630,26230,2400,"JP"
"The Fish Database of Taiwan",,21627,22242,2800,"TW"
"Macaulay Library Audio and Video Collection",,21198,173503,979,"US"
"Weddell Seal Sightings, Vestfold Hills, Antarctica",,21172,21172,1,"AU"
"The Second Atlas of Breeding Birds in Britain and Ireland: 1988-1991",,21106,247842,59,"IE"
"IndOBIS, Indian Ocean Node of OBIS",t,20837,23700,18032,"IN"
"Distribution of planktic foraminifera in surface sediments of the Atlantic Ocean",,20792,23769,21,"DE"
"Naturalis Biodiversity Center (NL) - Cainozoic Mollusca",,20642,27318,2521,"NL"
"Lund Botanical Museum (LD)",,20361,709162,950,"SE"
"Sheffield Biological Records Centre - Sheffield Biological Records Centre- Non-sensitive Records from all taxonomic groups.",,20351,358408,266,"GB"
"Taxonomic Information Sytem for the Belgian coastal area (EurOBIS)",t,20346,20997,6466,""
"Zoology (Museum of Evolution - Uppsala)",,20172,47952,3841,"SE"
"Colección Nacional de Peces del IBUNAM",,20089,24264,1068,"MX"
"Bird Observation Data",,20075,57079,78,"TW"
"Broedvogels - Atlas of the breeding birds in Flanders 2000-2002",,20025,330046,34,"BE"
"Canadian Museum of Nature - Fish Collection (OBIS Canada)",t,19990,29778,969,""
"TNHC Ichthyology Collection",,19937,55481,888,"US"
"Birds (NSMK-BI)",,19784,59679,90,"KR"
"RAVON (NL) - Fish observations extracted from historic reports 1860-1907",,19700,19700,4,"NL"
"Wildbook for Whale Sharks",,19530,19530,1,"AU"
"Echinoderm collection (IE) of the Muséum national d'Histoire naturelle (MNHN - Paris)",,19426,19427,1923,"FR"
"SOMBASE BIOCONSTRUCTORS",,19419,19452,3283,"GB"
"NINA Vanndata øvrige arter",,19419,81725,100,"NO"
"NRM-Fishes",,19363,39850,2755,"SE"
"Edaphobase",,19096,226747,600,"DE"
"British Lichen Society - BLS Lichen Database: Scotland",,19037,308202,119,"GB"
"Zooplankton in the bay of Biscay (1995-2004 Yearly spring DEPM surveys)",,18837,18837,46,"ES"
"UWBM Ornithology Collection",,18583,99655,390,"US"
"NCOS1959_Crustacea (OBIS China)",t,18567,19320,587,""
"Field Museum of Natural History (Zoology) Bird Collection",,18513,486310,442,"US"
"Gwaii Haanas Invertebrates (OBIS Canada)",t,18147,18485,1986,""
"CUMV Fish Collection (Arctos)",,17763,81576,1793,"US"
"Marine and Coastal Management - Demersal Surveys (years 1996-2000) (AfrOBIS)",t,17754,17754,257,""
"Natal Museum - Mollusc Collection (AfrOBIS)",t,17513,17588,1600,""
"Estonian Nature Observations Database",,17417,173674,107,"EE"
"Birds (KIEE-BI)",,17339,52000,60,"KR"
"Vertebrates of the Gothenburg Natural History Museum (GNM)",,17199,51978,1379,"SE"
"SINBIOTA - marine data (OBIS South America, BRAZIL)",t,17164,17263,776,""
"Hexacoral Database",t,17088,17273,2527,""
"SLU Aqua Institute of Freshwater Research National register of survey test-fishing - NORS",,16905,16921,37,"SE"
"Sponges of Rathlin Island",,16746,16747,894,"IE"
"Monitoring data from the federal state North Rhine-Westphalia (Germany)",,16736,71328,114,"DE"
"Canadian Museum of Nature Bird Collection",,16727,88293,189,"CA"
"Macrobel: Long term trends in the macrobenthos of the Belgian Continental Shelf (EurOBIS)",t,16560,16560,261,""
"Inventaire National du Patrimoine Naturel : Données des campagnes de Suivi Aérien de la Mégafaune Marine (SAMM) de France métropolitaine",,16555,16568,37,"FR"
"Ontario Breeding Bird Atlas 2001-2005",,16524,189946,62,"CA"
"Sheffield Bird Study Group - Sheffield Bird Study Group (Yorkshire records)",,16484,87100,71,"GB"
"Conchological Society of Great Britain &amp; Ireland - Mollusc (non-marine): 1999 Atlas Dataset  for Great Britain and Ireland",,16215,180609,23,"GB"
"BC Coastal Waterbird Survey",,16199,21200,98,"CA"
"AIMS - GBR Nearshore Coral Diversity (OBIS Australia)",t,16077,16088,283,""
"Marine invertabrate(Mollusca) specimen database of Osaka Museum of Natural History",,15987,18634,3824,"JP"
"Fieldjournal.org observation database",,15985,227785,175,"FI"
"Canadian Lakes Loon Survey",,15883,15883,1,"CA"
"Dutch Centre For Field Ornithology (SOVON) - Breeding Bird Monitoring Program",,15872,93792,9,"NL"
"Vertebrate Zoology Division - Ichthyology, Yale Peabody Museum",,15769,23231,2638,"US"
"(Table T2) Foraminifer distribution in ODP Site 188-1165 sediments",,15744,17220,64,"DE"
"UMMZ Birds Collection",,15734,207268,493,"US"
"NSW herbarium collection",,15668,577397,1941,"AU"
"Zoological Museum Amsterdam, University of Amsterdam (NL) - Porifera",,15660,15827,2245,"NL"
"Collection Crustacea - ZMB",,15635,21603,4683,"DE"
